<?xml version="1.0" encoding="UTF-8"?>
<ST-Stepper xmlns:xsi="http://www.w3.org/2001/XMLSchema-instance" xsi:noNamespaceSchemaLocation="Stepper-V2.xsd">
	<ST-ThreadPool>6</ST-ThreadPool>
	<ST-Flows>
		<ST-Flow name="Rename Files Zip Results">
			<ST-FlowDescription>Given a folder adds prefix and\or suffix to each file name.</ST-FlowDescription>		
			<ST-FlowOutput>TOTAL_FOUND</ST-FlowOutput>
			<ST-StepsInFlow>
				<ST-StepInFlow name="Collect Files In Folder"/>
			</ST-StepsInFlow>
			<ST-Continuations>
				<ST-Continuation target-flow="Delete Matched Files">
					<ST-Continuation-Mapping source-data="TOTAL_FOUND" target-data="TIME_TO_SPEND"/>
				</ST-Continuation>
			</ST-Continuations>
		</ST-Flow>
		<ST-Flow name="Delete Matched Files">
			<ST-FlowDescription>Given a folder, deletes files matching a certain pattern</ST-FlowDescription>		
			<ST-FlowOutput>TOTAL_FOUND,DELETION_STATS</ST-FlowOutput>
			<ST-StepsInFlow>
				<ST-StepInFlow name="Collect Files In Folder"/>
				<ST-StepInFlow name="Spend Some Time"/>
				<ST-StepInFlow name="Files Deleter"/>
			</ST-StepsInFlow>
		</ST-Flow>
	</ST-Flows>
</ST-Stepper>
