<?xml version="1.0" encoding="UTF-8"?>
<ST-Stepper xmlns:xsi="http://www.w3.org/2001/XMLSchema-instance" xsi:noNamespaceSchemaLocation="Stepper-V2.xsd">
	<ST-ThreadPool>6</ST-ThreadPool>
	<ST-Flows>
		<ST-Flow name="Rename Files Zip Results">
			<ST-FlowDescription>Given a folder adds prefix and\or suffix to each file name.</ST-FlowDescription>		
			<ST-FlowOutput>TOTAL_FOUND2</ST-FlowOutput>
			<ST-StepsInFlow>
				<ST-StepInFlow name="Collect Files In Folder"/>
			</ST-StepsInFlow>
			<ST-FlowLevelAliasing>
				<ST-FlowLevelAlias step="Collect Files In Folder" source-data-name="TOTAL_FOUND" alias="TOTAL_FOUND2"/>
			</ST-FlowLevelAliasing>
			<ST-Continuations>
				<ST-Continuation target-flow="Delete Matched Files">
				</ST-Continuation>
			</ST-Continuations>
						
		</ST-Flow>
		<ST-Flow name="Delete Matched Files">
			<ST-FlowDescription>Given a folder, deletes files matching a certain pattern</ST-FlowDescription>		
			<ST-FlowOutput>TOTAL_FOUND,DELETION_STATS</ST-FlowOutput>
			<ST-StepsInFlow>
				<ST-StepInFlow name="Collect Files In Folder"/>
				<ST-StepInFlow name="Spend Some Time"/>
				<ST-StepInFlow name="Files Deleter"/>
			</ST-StepsInFlow>
			<ST-FlowLevelAliasing>
				<ST-FlowLevelAlias step="Spend Some Time" source-data-name="TIME_TO_SPEND" alias="TOTAL_FOUND2"/>
			</ST-FlowLevelAliasing>
			<ST-InitialInputValues>
				<ST-InitialInputValue input-name="FOLDER_NAME" initial-value="C:\Users\asafr\OneDrive\מסמכים\GitHub\stepper\data\Ex2\try\deleter"/>
			</ST-InitialInputValues>
			<ST-Continuations>
				<ST-Continuation target-flow="Rename Files Zip Results">
				</ST-Continuation>
			</ST-Continuations>
		</ST-Flow>
	</ST-Flows>
</ST-Stepper>
